Priority,UAI,Asset Name,System,Catalogue Codes,Product Passport,Passport Action,New Evidence Objects,Closure Class,Closure State,Identity Gate,Quality Gate,Sterility Gate,Direct Sale Gate,Platinum Status
P1,CERT-MPS-000001,AICAR Supplier Product Family,MPS,AR50; AR100,CERT-PPS-000001,PATCH,CERT-EKS-000283; CERT-EKS-000284,AICA RIBOSIDE / ACADESINE VERSUS PHOSPHORYLATED AICAR IDENTITY,"PARTIAL CLOSURE — HUMAN ACADESINE DEVELOPMENT AND CURRENT ANTI-DOPING STATUS IDENTIFIED; SUPPLIER CHEMICAL FORM, SALT, GRADE AND ROUTE OPEN",BLOCKED,BLOCKED,BLOCKED,BLOCKED,NO
P1,CERT-MPS-000002,Melatonin Supplier Vial Family,MPS,MT10,CERT-PPS-000002,PATCH,CERT-EKS-000285; CERT-EKS-000286,AUTHORISED ORAL PRODUCT VERSUS UNSPECIFIED SUPPLIER VIAL,"PARTIAL CLOSURE — CURRENT EU ORAL MEDICINE CONTEXTS IDENTIFIED; SUPPLIER ROUTE, FORMULATION, RELEASE PROFILE, STERILITY AND EQUIVALENCE OPEN",BLOCKED,BLOCKED,BLOCKED,BLOCKED,NO
P1,CERT-MPS-000003,Glutathione Supplier Vial Family,MPS,GTT,CERT-PPS-000003,PATCH,CERT-EKS-000287; CERT-EKS-000288,REDUCED/OXIDISED FORM AND STERILE-INJECTABLE QUALITY,"BLOCKED — REDOX FORM, SALT, ROUTE, STERILE GRADE, ENDOTOXIN, POTENCY AND PRODUCT-SPECIFIC CLINICAL EVIDENCE UNVERIFIED",BLOCKED,BLOCKED,BLOCKED,BLOCKED,NO
P1,CERT-MPS-000004,5-Amino-1MQ Supplier Product Family,MPS,5AM; 10AM; 50AM,CERT-PPS-000004,PATCH,CERT-EKS-000289; CERT-EKS-000290,PRECLINICAL NNMT INHIBITOR / SALT AND HUMAN EVIDENCE,"PARTIAL CLOSURE — CELL AND MOUSE NNMT-INHIBITOR PROGRAMME IDENTIFIED; SUPPLIER SALT, FORMAL TOXICOLOGY, HUMAN PK, EFFICACY AND APPROVAL OPEN",BLOCKED,BLOCKED,BLOCKED,BLOCKED,NO
P1,CERT-MPS-000005,NAD Supplier Product Family,MPS,NJ3100; NJ250; NJ500; NJ1000,CERT-PPS-000005,PATCH,CERT-EKS-000291; CERT-EKS-000292,NAD+ / NADH CHEMICAL FORM AND UNAPPROVED INJECTABLE QUALITY,"BLOCKED — NAD+ VERSUS NADH, SALT, CONCENTRATION, ROUTE, STERILE GRADE, ENDOTOXIN AND PRODUCT EQUIVALENCE UNVERIFIED",BLOCKED,BLOCKED,BLOCKED,BLOCKED,NO
P1,CERT-PKS-000089,Elamipretide / SS-31,PKS,2S10; 2S50,CERT-PPS-000031,NEW,CERT-EKS-000293; CERT-EKS-000294,AUTHORISED FORZINITY PRODUCT VERSUS SUPPLIER SS-31 POWDER,"PARTIAL CLOSURE — CANONICAL ELAMIPRETIDE AND CURRENT FORZINITY STATUS IDENTIFIED; SUPPLIER SALT, STERILITY, FORMULATION, MANUFACTURER AND COMPARABILITY OPEN",BLOCKED,BLOCKED,BLOCKED,BLOCKED,NO
P1,CERT-PKS-000090,Generic GLP-1 Supplier Product Family,PKS,GP,CERT-PPS-000032,NEW,CERT-EKS-000295; CERT-EKS-000296,CRITICAL NATIVE GLP-1 MOLECULAR FORM AND PRODUCT IDENTITY,"BLOCKED — RESIDUE RANGE, C-TERMINAL FORM, ANALOGUE STATUS, SALT, POTENCY, ROUTE, STERILITY AND PRODUCT-SPECIFIC HUMAN EVIDENCE UNVERIFIED",BLOCKED,BLOCKED,BLOCKED,BLOCKED,NO
