Priority,UAI,Asset Name,Catalogue Codes,Reference Identity,Identity Status,Product Passport,New Evidence Objects,Closure Class,Closure State,Supplier Sequence Gate,Terminal Chemistry Gate,Quality Gate,Sterility Gate,Human Evidence Gate,Direct Sale Gate,Platinum Status
P1,CERT-PKS-000072,Pancragen,PA20,KEDW,REFERENCE SEQUENCE PARTIALLY CLOSED,CERT-PPS-000045,CERT-EKS-000321; CERT-EKS-000322,KEDW TETRAPEPTIDE / TERMINAL AMIDE AND SUPPLIER EQUIVALENCE,"PARTIAL CLOSURE — PANCRAGEN RESIDUE ORDER LYS-GLU-ASP-TRP (KEDW) AND NON-HUMAN/HUMAN REGIONAL LITERATURE IDENTIFIED; PA20 TERMINAL CHEMISTRY, SALT, ANALYTICAL IDENTITY, STERILITY AND CLINICAL EQUIVALENCE OPEN",BLOCKED,BLOCKED,BLOCKED,BLOCKED,BLOCKED,BLOCKED,NO
P1,CERT-PKS-000073,Prostamax,MAX20,KEDP,REFERENCE SEQUENCE CLOSED,CERT-PPS-000046,CERT-EKS-000323; CERT-EKS-000324,KEDP TETRAPEPTIDE / PROSTATE POSITIONING AND SUPPLIER EQUIVALENCE,"PARTIAL CLOSURE — NLM/PUBCHEM IDENTITY LYS-GLU-ASP-PRO (KEDP) AND LIMITED CHROMATIN/ORGANOTYPIC LITERATURE IDENTIFIED; MAX20 TERMINI, SALT, ANALYTICAL IDENTITY, STERILITY AND CONTROLLED HUMAN BENEFIT OPEN",BLOCKED,BLOCKED,BLOCKED,BLOCKED,BLOCKED,BLOCKED,NO
P1,CERT-PKS-000074,Cartalax,LAX20,AED,REFERENCE SEQUENCE CLOSED,CERT-PPS-000047,CERT-EKS-000325; CERT-EKS-000326,AED TRIPEPTIDE / CARTILAGE POSITIONING AND SUPPLIER EQUIVALENCE,"PARTIAL CLOSURE — NLM MESH/PUBCHEM IDENTITY ALA-GLU-ASP (AED) AND PRECLINICAL CELLULAR LITERATURE IDENTIFIED; LAX20 TERMINI, SALT, ANALYTICAL IDENTITY, STERILITY AND CONTROLLED HUMAN BENEFIT OPEN",BLOCKED,BLOCKED,BLOCKED,BLOCKED,BLOCKED,BLOCKED,NO
P1,CERT-PKS-000075,Chonluten,CH20,EDG,REFERENCE SEQUENCE CLOSED,CERT-PPS-000048,CERT-EKS-000327; CERT-EKS-000328,EDG TRIPEPTIDE / RESPIRATORY AND IMMUNE CELL-CULTURE EVIDENCE,"PARTIAL CLOSURE — PRIMARY METHODS IDENTIFY CHONLUTEN AS GLU-ASP-GLY (EDG) AND HUMAN THP-1 CELL-CULTURE EVIDENCE EXISTS; CH20 TERMINI, SALT, ANALYTICAL IDENTITY, STERILITY AND HUMAN CLINICAL BENEFIT OPEN",BLOCKED,BLOCKED,BLOCKED,BLOCKED,BLOCKED,BLOCKED,NO
P1,CERT-PKS-000076,Crystagen,CRY20,UNRESOLVED: EDP / PQN conflict,CRITICAL IDENTITY CONFLICT,CERT-PPS-000049,CERT-EKS-000329; CERT-EKS-000330,CONFLICTING SUPPLIER IDENTITY / IMMUNE BIOREGULATOR NAME,"BLOCKED — PUBLIC SOURCES CONFLICT BETWEEN EDP AND PQN IDENTITIES, NO AUTHORITATIVE PRIMARY SEQUENCE RECORD WAS CLOSED, AND CRY20 TERMINI, SALT, ANALYTICAL IDENTITY, STERILITY AND HUMAN EVIDENCE REMAIN OPEN",BLOCKED,BLOCKED,BLOCKED,BLOCKED,BLOCKED,BLOCKED,NO
P1,CERT-PKS-000077,Ovagen,OV20,UNRESOLVED: commonly claimed EDL; conflicting/unverified,CRITICAL NAME AND IDENTITY CONFLICT,CERT-PPS-000050,CERT-EKS-000331; CERT-EKS-000332,NAME COLLISION AND CONFLICTING SHORT-PEPTIDE IDENTITY,"BLOCKED — OVAGEN NAME COLLIDES WITH A VETERINARY FSH PRODUCT; SHORT-PEPTIDE SOURCES CONFLICT OR LACK PRIMARY AUTHENTICATION, AND OV20 SEQUENCE, TERMINI, SALT, QUALITY AND HUMAN EVIDENCE REMAIN OPEN",BLOCKED,BLOCKED,BLOCKED,BLOCKED,BLOCKED,BLOCKED,NO
P1,CERT-PKS-000078,Vesugen,VE20,KED,REFERENCE SEQUENCE CLOSED,CERT-PPS-000051,CERT-EKS-000333; CERT-EKS-000334,KED TRIPEPTIDE / VASCULAR POSITIONING AND SUPPLIER EQUIVALENCE,"PARTIAL CLOSURE — PRIMARY LITERATURE IDENTIFIES VESUGEN AS LYS-GLU-ASP (KED) AND CELL/SMALL REGIONAL HUMAN REPORTS EXIST; VE20 TERMINI, SALT, ANALYTICAL IDENTITY, STERILITY AND CONTROLLED HUMAN BENEFIT OPEN",BLOCKED,BLOCKED,BLOCKED,BLOCKED,BLOCKED,BLOCKED,NO
