Evidence ID,Publication,Year,Evidence Level,Primary Source State,Direct Full Text Extracted,Closure State,Next Action
CERT-EKS-000015,Gastric pentadecapeptide BPC 157 accelerates healing of transected rat Achilles tendon and in vitro stimulates tendocytes growth,2003,Preclinical,PRIMARY PUBLICATION IDENTIFIED — DIRECT EXTRACTION PENDING,No,OPEN / IDENTIFIED,Capture and appraise direct primary source
CERT-EKS-000016,"The promoting effect of pentadecapeptide BPC 157 on tendon healing involves tendon outgrowth, cell survival, and cell migration",2011,Preclinical,PRIMARY PUBLICATION IDENTIFIED — DIRECT EXTRACTION PENDING,No,OPEN / IDENTIFIED,Capture and appraise direct primary source
CERT-EKS-000017,Pentadecapeptide BPC 157 (PL 14736) improves ligament healing in the rat,2010,Preclinical,PRIMARY PUBLICATION IDENTIFIED — DIRECT EXTRACTION PENDING,No,OPEN / IDENTIFIED,Capture and appraise direct primary source
CERT-EKS-000018,Modulatory effects of BPC 157 on vasomotor tone and the activation of Src-Caveolin-1-endothelial nitric oxide synthase pathway,2020,Preclinical,PRIMARY PUBLICATION IDENTIFIED — DIRECT EXTRACTION PENDING,No,OPEN / IDENTIFIED,Capture and appraise direct primary source
CERT-EKS-000019,"Preclinical safety evaluation of body protective compound-157, a potential drug for treating various wounds",2020,Preclinical safety,PRIMARY PUBLICATION IDENTIFIED — DIRECT EXTRACTION PENDING,No,OPEN / IDENTIFIED,Capture and appraise direct primary source
CERT-EKS-000020,"Pharmacokinetics, distribution, metabolism, and excretion of body-protective compound 157, a potential drug for treating various wounds, in rats and dogs",2022,Preclinical pharmacology,PRIMARY PUBLICATION IDENTIFIED — DIRECT EXTRACTION PENDING,No,OPEN / IDENTIFIED,Capture and appraise direct primary source
CERT-EKS-000021,Intra-Articular Injection of BPC 157 for Multiple Types of Knee Pain,2021,Limited human evidence,HUMAN PUBLICATION IDENTIFIED — METHODOLOGICAL AND PRIMARY-SOURCE REVIEW PENDING,No,OPEN / IDENTIFIED,Capture and appraise direct primary source
CERT-EKS-000022,Effect of BPC-157 on Symptoms in Patients with Interstitial Cystitis: A Pilot Study,2024,Limited human evidence,HUMAN PUBLICATION IDENTIFIED — METHODOLOGICAL AND PRIMARY-SOURCE REVIEW PENDING,No,OPEN / IDENTIFIED,Capture and appraise direct primary source
