Evidence ID,Stage,Domain,Tier,Source Status,Primary Contribution
CERT-EKS-000007,Preclinical + Phase 1,Mechanism / PK,A,Primary captured,Receptor pharmacology and proof of concept
CERT-EKS-000008,Phase 2,Obesity,A,Primary captured,Dose-ranging weight efficacy and safety
CERT-EKS-000009,Phase 2,Type 2 diabetes,A,Primary captured,"HbA1c, weight and safety"
CERT-EKS-000010,Phase 2 substudy,Body composition,A,Publication identified,Body-composition evidence; extraction pending
CERT-EKS-000011,Phase 3,Obesity,B,Sponsor topline captured,Pivotal efficacy topline
CERT-EKS-000012,Phase 3,Type 2 diabetes,C,Secondary lead,Late-stage glycaemic/weight lead
CERT-EKS-000013,Phase 3,Obesity + knee OA,C,Secondary lead,"Weight, pain and emerging safety signals"
CERT-EKS-000014,Substudy / metabolic,Liver fat / MASLD,C,Secondary lead,Liver-fat evidence lead
