Authority,Source,URL,Applied Requirement
FDA,"Control of components, containers and closures — CGMP Q&A",https://www.fda.gov/drugs/guidances-drugs/questions-and-answers-current-good-manufacturing-practice-requirements-control-components-and-drug,"Representative sampling, specific identity testing, supplier COA reliability validation and batch-specific component control"
FDA,Production and process controls — CGMP Q&A,https://www.fda.gov/drugs/guidances-drugs/questions-and-answers-current-good-manufacturing-practice-regulations-production-and-process,"Written specifications, testing, microbiological controls, sterility and process validation"
FDA,Sterile drug products produced by aseptic processing — CGMP,https://www.fda.gov/regulatory-information/search-fda-guidance-documents/sterile-drug-products-produced-aseptic-processing-current-good-manufacturing-practice,"Aseptic-process, contamination-control, environmental-monitoring and sterile-quality evidence"
EMA / EU,Good manufacturing practice overview and Annex 1 status,https://www.ema.europa.eu/en/human-regulatory-overview/research-development/compliance-research-development/good-manufacturing-practice,"EU GMP, active-substance manufacturer controls and current sterile-manufacturing Annex 1"
EMA / ICH,ICH Q7 Good manufacturing practice for active pharmaceutical ingredients,https://www.ema.europa.eu/en/ich-q7-good-manufacturing-practice-active-pharmaceutical-ingredients-scientific-guideline,"API quality management, manufacturing, laboratory controls and certificate-of-analysis content"
ICH,Quality guidelines,https://admin.ich.org/page/quality-guidelines,"Q1 stability, Q2 analytical validation, Q5 biologics, Q6 specifications, Q7 GMP, Q9 risk management, Q10 quality systems and Q14 analytical development"
MHRA,Guidance on GxP data integrity,https://www.gov.uk/government/publications/guidance-on-gxp-data-integrity,"Data governance, provenance, original records, audit trails and complete data"
